end_date,link,location,name,season,start_date,tour,year
Nov 28 2004,https://www.europeantour.com//europeantour/season=2005/tournamentid=2004080/leaderboard/index.html,"Shanghai Silport GC, Shanghai, China PR",Volvo China Open,2005,Nov 25 2004,Euro,2004
Dec 05 2004,https://www.europeantour.com//europeantour/season=2005/tournamentid=2004082/leaderboard/index.html,"Hong Kong GC, Fanling, Hong Kong",Omega Hong Kong Open,2005,Dec 02 2004,Euro,2004
Dec 12 2004,https://www.europeantour.com//europeantour/season=2005/tournamentid=2004084/leaderboard/index.html,"Leopard Creek CC, Malelane, South Africa",dunhill championship,2005,Dec 09 2004,Euro,2004
Jan 23 2005,https://www.europeantour.com//europeantour/season=2005/tournamentid=2005001/leaderboard/index.html,"Durban Country Club, Durban, KwaZulu-Natal Province, South Africa",South African Airways Open,2005,Jan 20 2005,Euro,2005
Jan 30 2005,https://www.europeantour.com//europeantour/season=2005/tournamentid=2005002/leaderboard/index.html,"Laguna National G&CC, Tampines, Singapore",Caltex Masters presented by Carlsberg Singapore 2005,2005,Jan 27 2005,Euro,2005
Feb 06 2005,https://www.europeantour.com//europeantour/season=2005/tournamentid=2005003/leaderboard/index.html,"Royal Melbourne GC, Victoria, Australia",Heineken Classic,2005,Feb 03 2005,Euro,2005
Feb 13 2005,https://www.europeantour.com//europeantour/season=2005/tournamentid=2005004/leaderboard/index.html,"Gulf Harbour CC, Auckland, New Zealand",Holden New Zealand Open,2005,Feb 10 2005,Euro,2005
Feb 20 2005,https://www.europeantour.com//europeantour/season=2005/tournamentid=2005005/leaderboard/index.html,"Saujana G&CC, Kuala Lumpur, Malaysia",Carlsberg Malaysian Open,2005,Feb 17 2005,Euro,2005
Feb 27 2005,https://www.europeantour.com//europeantour/season=2005/tournamentid=2005006/leaderboard/index.html,"La Costa Resort & Spa, Carlsbad, CA, USA",WGC-Accenture Match Play,2005,Feb 23 2005,Euro,2005
Mar 06 2005,https://www.europeantour.com//europeantour/season=2005/tournamentid=2005007/leaderboard/index.html,"Emirates GC, Dubai, United Arab Emirates",Dubai Desert Classic,2005,Mar 03 2005,Euro,2005
Mar 13 2005,https://www.europeantour.com//europeantour/season=2005/tournamentid=2005008/leaderboard/index.html,"Doha GC, Doha, Qatar",Qatar Masters,2005,Mar 10 2005,Euro,2005
Mar 20 2005,https://www.europeantour.com//europeantour/season=2005/tournamentid=2005009/leaderboard/index.html,"Yalong Bay GC, Hainan Island, China PR",TCL Classic,2005,Mar 17 2005,Euro,2005
Mar 27 2005,https://www.europeantour.com//europeantour/season=2005/tournamentid=2005011/leaderboard/index.html,"Cengkareng GC, Jakarta, Indonesia",Enjoy Jakarta Standard Chartered Indonesia Open,2005,Mar 24 2005,Euro,2005
Apr 03 2005,https://www.europeantour.com//europeantour/season=2005/tournamentid=2005012/leaderboard/index.html,"Oitavos Dunes, Cascais, Portugal",Estoril Open de Portugal Caixa Geral de Depositos,2005,Mar 31 2005,Euro,2005
Apr 10 2005,https://www.europeantour.com//europeantour/season=2005/tournamentid=2005014/leaderboard/index.html,"Augusta National GC, Augusta, Georgia, USA",Masters Tournament,2005,Apr 07 2005,Euro,2005
Apr 10 2005,https://www.europeantour.com//europeantour/season=2005/tournamentid=2005015/leaderboard/index.html,"Clube de Golf do Santo da Serra, Madeira, Portugal",Madeira Island Open Caixa Geral de Depositos,2005,Apr 07 2005,Euro,2005
Apr 17 2005,https://www.europeantour.com//europeantour/season=2005/tournamentid=2005016/leaderboard/index.html,"San Roque Club, Sotogrande, Spain",Jazztel Open de España en Andalucía,2005,Apr 14 2005,Euro,2005
Apr 24 2005,https://www.europeantour.com//europeantour/season=2005/tournamentid=2005018/leaderboard/index.html,"Pine Valley Golf Resort & CC, Beijing, China PR",Johnnie Walker Classic,2005,Apr 21 2005,Euro,2005
May 01 2005,https://www.europeantour.com//europeantour/season=2005/tournamentid=2005020/leaderboard/index.html,"Tomson Shanghai Pudong GC, Shanghai, China PR",BMW Asian Open,2005,Apr 28 2005,Euro,2005
May 08 2005,https://www.europeantour.com//europeantour/season=2005/tournamentid=2005022/leaderboard/index.html,"Castello di Tolcinasco G&CC, Milan, Italy",Telecom Italia Open,2005,May 05 2005,Euro,2005
May 15 2005,https://www.europeantour.com//europeantour/season=2005/tournamentid=2005024/leaderboard/index.html,"Forest of Arden Hotel & CC, Coventry, England",Daily Telegraph Dunlop Masters,2005,May 12 2005,Euro,2005
May 22 2005,https://www.europeantour.com//europeantour/season=2005/tournamentid=2005026/leaderboard/index.html,"Carton House GC, Maynooth, Co. Kildare, Republic of Ireland",Nissan Irish Open,2005,May 19 2005,Euro,2005
May 29 2005,https://www.europeantour.com//europeantour/season=2005/tournamentid=2005028/leaderboard/index.html,"Wentworth Golf Club, Virginia Water, Surrey, England",BMW CHAMPIONSHIP,2005,May 26 2005,Euro,2005
Jun 05 2005,https://www.europeantour.com//europeantour/season=2005/tournamentid=2005030/leaderboard/index.html,"The Celtic Manor Resort, City of Newport, Wales",Celtic Manor Wales Open,2005,Jun 02 2005,Euro,2005
Jun 12 2005,https://www.europeantour.com//europeantour/season=2005/tournamentid=2005032/leaderboard/index.html,"Hilversumsche GC, Hilversum, Netherlands",KLM Open,2005,Jun 09 2005,Euro,2005
Jun 19 2005,https://www.europeantour.com//europeantour/season=2005/tournamentid=2005034/leaderboard/index.html,"Pinehurst Resort, Village of Pinehurst, North Carolina, USA",U.S. Open,2005,Jun 16 2005,Euro,2005
Jun 19 2005,https://www.europeantour.com//europeantour/season=2005/tournamentid=2005036/leaderboard/index.html,"Aa Saint-Omer GC, Lumbres, France",Aa St Omer Open,2005,Jun 16 2005,Euro,2005
Jun 26 2005,https://www.europeantour.com//europeantour/season=2005/tournamentid=2005038/leaderboard/index.html,"Le Golf National, Paris, France",Open de France,2005,Jun 23 2005,Euro,2005
Jul 03 2005,https://www.europeantour.com//europeantour/season=2005/tournamentid=2005040/leaderboard/index.html,"The K Club, Straffan, Co. Kildare, Republic of Ireland",Smurfit European Open,2005,Jun 30 2005,Euro,2005
Jul 10 2005,https://www.europeantour.com//europeantour/season=2005/tournamentid=2005042/leaderboard/index.html,"Loch Lomond GC, Glasgow, Scotland",Barclays Scottish Open,2005,Jul 07 2005,Euro,2005
Jul 17 2005,https://www.europeantour.com//europeantour/season=2005/tournamentid=2005044/leaderboard/index.html,"St. Andrews, Old Course, Fife, Scotland",134th Open Championship,2005,Jul 14 2005,Euro,2005
Jul 24 2005,https://www.europeantour.com//europeantour/season=2005/tournamentid=2005046/leaderboard/index.html,"Gut Kaden GC, Hamburg, Germany",Deutsche Bank Players Championship of Europe,2005,Jul 21 2005,Euro,2005
Jul 31 2005,https://www.europeantour.com//europeantour/season=2005/tournamentid=2005048/leaderboard/index.html,"Kungsangen GC, Stockholm, Sweden",Scandinavian Masters by Carlsberg,2005,Jul 28 2005,Euro,2005
Aug 07 2005,https://www.europeantour.com//europeantour/season=2005/tournamentid=2005050/leaderboard/index.html,"The Gleneagles Hotel, Perthshire, Scotland",Johnnie Walker Championship at Gleneagles,2005,Aug 04 2005,Euro,2005
Aug 14 2005,https://www.europeantour.com//europeantour/season=2005/tournamentid=2005052/leaderboard/index.html,"Baltusrol GC, Springfield, New Jersey, USA",US PGA Championship,2005,Aug 11 2005,Euro,2005
Aug 14 2005,https://www.europeantour.com//europeantour/season=2005/tournamentid=2005054/leaderboard/index.html,"Le Meridien Moscow CC, Moscow, Russia",Cadillac Russian Open,2005,Aug 11 2005,Euro,2005
Aug 21 2005,https://www.europeantour.com//europeantour/season=2005/tournamentid=2005056/leaderboard/index.html,"Firestone CC, Akron, Ohio, USA",WGC-NEC Invitational,2005,Aug 18 2005,Euro,2005
Aug 28 2005,https://www.europeantour.com//europeantour/season=2005/tournamentid=2005058/leaderboard/index.html,"Golfclub München Eichenried, Eichenried, Munich, Germany",BMW International Open,2005,Aug 25 2005,Euro,2005
Sep 04 2005,https://www.europeantour.com//europeantour/season=2005/tournamentid=2005060/leaderboard/index.html,"Crans-sur-Sierre GC, Crans Montana, Switzerland",Omega European Masters,2005,Sep 01 2005,Euro,2005
Sep 11 2005,https://www.europeantour.com//europeantour/season=2005/tournamentid=2005062/leaderboard/index.html,"Golf Club Gut Lärchenhof, Cologne, Germany",Linde German Masters,2005,Sep 08 2005,Euro,2005
Sep 18 2005,https://www.europeantour.com//europeantour/season=2005/tournamentid=2005064/leaderboard/index.html,"Wentworth Golf Club, Virginia Water, Surrey, England",HSBC World Match Play Championship,2005,Sep 15 2005,Euro,2005
Sep 25 2005,https://www.europeantour.com//europeantour/season=2005/tournamentid=2005066/leaderboard/index.html,"The Wynyard Club, Billingham, Tees Valley, England",Seve Trophy*,2005,Sep 22 2005,Euro,2005
Oct 02 2005,https://www.europeantour.com//europeantour/season=2005/tournamentid=2005068/leaderboard/index.html,"Old Course St. Andrews, Carnoustie & Kingsbarns, Scotland, Scotland",dunhill links championship,2005,Sep 29 2005,Euro,2005
Oct 09 2005,https://www.europeantour.com//europeantour/season=2005/tournamentid=2005070/leaderboard/index.html,"TPC Harding Park, San Francisco, California, USA",WGC-American Express Championship,2005,Oct 06 2005,Euro,2005
Oct 09 2005,https://www.europeantour.com//europeantour/season=2005/tournamentid=2005071/leaderboard/index.html,"Abama GC, Tenerife, Spain",Abama Open de Canarias 2005,2005,Oct 06 2005,Euro,2005
Oct 16 2005,https://www.europeantour.com//europeantour/season=2005/tournamentid=2005072/leaderboard/index.html,"Club de Campo, Madrid, Spain",Open de Madrid,2005,Oct 13 2005,Euro,2005
Oct 23 2005,https://www.europeantour.com//europeantour/season=2005/tournamentid=2005074/leaderboard/index.html,"Pula GC, Son Servera, Mallorca, Spain",Mallorca Classic,2005,Oct 20 2005,Euro,2005
Oct 30 2005,https://www.europeantour.com//europeantour/season=2005/tournamentid=2005076/leaderboard/index.html,"Real Club Valderrama, Sotogrande, Spain",Volvo Masters,2005,Oct 27 2005,Euro,2005
Nov 20 2005,https://www.europeantour.com//europeantour/season=2005/tournamentid=2005078/leaderboard/index.html,"Dom Pedro Victoria Golf Course, Vilamoura, Portugal",WGC-Algarve World Cup in Portugal*,2005,Nov 17 2005,Euro,2005
Nov 24 2002,https://www.europeantour.com//europeantour/season=2003/tournamentid=2002086/leaderboard/index.html,"Westin Resort Ta Shee G&CC, Taipei, Taiwan",BMW Asian Open,2003,Nov 21 2002,Euro,2002
Nov 14 1999,https://www.europeantour.com//europeantour/season=2000/tournamentid=1999084/leaderboard/index.html,"Westin Resort Ta Shee G&CC, Taipei, Taiwan",Johnnie Walker Classic,2000,Nov 11 1999,Euro,1999
Dec 01 2002,https://www.europeantour.com//europeantour/season=2003/tournamentid=2002088/leaderboard/index.html,"Hong Kong GC, Fanling, Hong Kong",Omega Hong Kong Open,2003,Nov 28 2002,Euro,2002
Jan 12 2003,https://www.europeantour.com//europeantour/season=2003/tournamentid=2003002/leaderboard/index.html,"Erinvale GC, Cape Town, South Africa",South African Airways Open,2003,Jan 09 2003,Euro,2003
Jan 19 2003,https://www.europeantour.com//europeantour/season=2003/tournamentid=2003003/leaderboard/index.html,"Houghton GC, Johannesburg, South Africa",dunhill championship,2003,Jan 16 2003,Euro,2003
Jan 26 2003,https://www.europeantour.com//europeantour/season=2003/tournamentid=2003004/leaderboard/index.html,"Laguna National G&CC, Tampines, Singapore",Caltex Masters presented by Carlsberg Singapore 2003,2003,Jan 23 2003,Euro,2003
Feb 02 2003,https://www.europeantour.com//europeantour/season=2003/tournamentid=2003005/leaderboard/index.html,"Royal Melbourne GC, Victoria, Australia",Heineken Classic,2003,Jan 30 2003,Euro,2003
Feb 09 2003,https://www.europeantour.com//europeantour/season=2003/tournamentid=2003006/leaderboard/index.html,"New South Wales GC, Sydney, Australia",ANZ Championship,2003,Feb 06 2003,Euro,2003
Feb 16 2003,https://www.europeantour.com//europeantour/season=2003/tournamentid=2003007/leaderboard/index.html,"Lake Karrinyup CC, Perth, Australia",Johnnie Walker Classic,2003,Feb 13 2003,Euro,2003
Feb 23 2003,https://www.europeantour.com//europeantour/season=2003/tournamentid=2003008/leaderboard/index.html,"The Mines Resort & GC, Kuala Lumpur, Malaysia",Carlsberg Malaysian Open,2003,Feb 20 2003,Euro,2003
Mar 02 2003,https://www.europeantour.com//europeantour/season=2003/tournamentid=2003009/leaderboard/index.html,"La Costa Resort & Spa, Carlsbad, CA, USA",WGC-Accenture Match Play,2003,Feb 26 2003,Euro,2003
Jan 16 2000,https://www.europeantour.com//europeantour/season=2000/tournamentid=2000002/leaderboard/index.html,"Houghton GC, Johannesburg, South Africa",Alfred Dunhill Championship,2000,Jan 13 2000,Euro,2000
Jan 23 2000,https://www.europeantour.com//europeantour/season=2000/tournamentid=2000004/leaderboard/index.html,"Randpark GC, Johannesburg, South Africa",Mercedes-Benz - S.A. Open Championship,2000,Jan 20 2000,Euro,2000
Jan 30 2000,https://www.europeantour.com//europeantour/season=2000/tournamentid=2000006/leaderboard/index.html,"The Vines Resort, Perth, Australia",Heineken Classic,2000,Jan 27 2000,Euro,2000
Feb 06 2000,https://www.europeantour.com//europeantour/season=2000/tournamentid=2000008/leaderboard/index.html,"The Lakes GC, Sydney, Australia",Greg Norman Holden International,2000,Feb 03 2000,Euro,2000
Feb 13 2000,https://www.europeantour.com//europeantour/season=2000/tournamentid=2000010/leaderboard/index.html,"Templer Park G&CC, Kuala Lumpur, Malaysia",Benson and Hedges Malaysian Open,2000,Feb 10 2000,Euro,2000
Feb 20 2000,https://www.europeantour.com//europeantour/season=2000/tournamentid=2000000/leaderboard/index.html,"Le Meridien Penina Golf & Resort, Portimao, Portugal",Algarve Portuguese Open,2000,Feb 17 2000,Euro,2000
Feb 27 2000,https://www.europeantour.com//europeantour/season=2000/tournamentid=2000014/leaderboard/index.html,"La Costa Resort & Spa, Carlsbad, CA, USA",WGC-Andersen Consulting Match Play,2000,Feb 23 2000,Euro,2000
Mar 05 2000,https://www.europeantour.com//europeantour/season=2000/tournamentid=2000016/leaderboard/index.html,"Dubai Creek Golf and Yacht Club, Dubai, United Arab Emirates",Dubai Desert Classic,2000,Mar 02 2000,Euro,2000
Mar 09 2003,https://www.europeantour.com//europeantour/season=2003/tournamentid=2003010/leaderboard/index.html,"Emirates GC, Dubai, United Arab Emirates",Dubai Desert Classic,2003,Mar 06 2003,Euro,2003
Mar 16 2003,https://www.europeantour.com//europeantour/season=2003/tournamentid=2003011/leaderboard/index.html,"Doha GC, Doha, Qatar",Qatar Masters,2003,Mar 13 2003,Euro,2003
Mar 23 2003,https://www.europeantour.com//europeantour/season=2003/tournamentid=2003012/leaderboard/index.html,"Clube de Golf do Santo da Serra, Madeira, Portugal",Madeira Island Open,2003,Mar 20 2003,Euro,2003
Apr 13 2003,https://www.europeantour.com//europeantour/season=2003/tournamentid=2003015/leaderboard/index.html,"Augusta National GC, Augusta, Georgia, USA",Masters Tournament,2003,Apr 10 2003,Euro,2003
Apr 20 2003,https://www.europeantour.com//europeantour/season=2003/tournamentid=2003016/leaderboard/index.html,"Vale do Lobo, Algarve, Portugal",Algarve Open de Portugal,2003,Apr 17 2003,Euro,2003
Apr 27 2003,https://www.europeantour.com//europeantour/season=2003/tournamentid=2003017/leaderboard/index.html,"Golf Costa Adeje, Tenerife, Spain",Canarias Open de España,2003,Apr 24 2003,Euro,2003
May 04 2003,https://www.europeantour.com//europeantour/season=2003/tournamentid=2003018/leaderboard/index.html,"Gardagolf CC, Brescia, Italy",60th Italian Open Telecom Italia,2003,May 01 2003,Euro,2003
Mar 12 2000,https://www.europeantour.com//europeantour/season=2000/tournamentid=2000018/leaderboard/index.html,"Doha GC, Doha, Qatar",Qatar Masters,2000,Mar 09 2000,Euro,2000
Mar 19 2000,https://www.europeantour.com//europeantour/season=2000/tournamentid=2000021/leaderboard/index.html,"Clube de Golf do Santo da Serra, Madeira, Portugal",Madeira Island Open,2000,Mar 16 2000,Euro,2000
Mar 26 2000,https://www.europeantour.com//europeantour/season=2000/tournamentid=2000020/leaderboard/index.html,"Itanhanga, Rio de Janeiro, Brazil",Brazil Rio de Janeiro 500 Years Open,2000,Mar 23 2000,Euro,2000
Apr 02 2000,https://www.europeantour.com//europeantour/season=2000/tournamentid=2000022/leaderboard/index.html,"São Paulo GC, São Paulo, Brazil",Brazil Sao Paulo 500 Years Open,2000,Mar 30 2000,Euro,2000
Apr 09 2000,https://www.europeantour.com//europeantour/season=2000/tournamentid=2000024/leaderboard/index.html,"Augusta National GC, Augusta, Georgia, USA",Masters Tournament,2000,Apr 06 2000,Euro,2000
Apr 16 2000,https://www.europeantour.com//europeantour/season=2000/tournamentid=2000025/leaderboard/index.html,"Sunningdale Golf Club (Old Course), Berkshire, England",Eurobet Seve Ballesteros Trophy*,2000,Apr 14 2000,Euro,2000
Apr 23 2000,https://www.europeantour.com//europeantour/season=2000/tournamentid=2000027/leaderboard/index.html,"Golf D'Amelkis, Marrakech, Morocco",Moroccan Open Méditel,2000,Apr 20 2000,Euro,2000
May 01 2000,https://www.europeantour.com//europeantour/season=2000/tournamentid=2000029/leaderboard/index.html,"PGA Catalunya Resort, Girona, Spain",Peugeot Open de España,2000,Apr 28 2000,Euro,2000
May 11 2003,https://www.europeantour.com//europeantour/season=2003/tournamentid=2003020/leaderboard/index.html,"The Belfry, Sutton Coldfield, England",Benson and Hedges International Open,2003,May 08 2003,Euro,2003
May 18 2003,https://www.europeantour.com//europeantour/season=2003/tournamentid=2003022/leaderboard/index.html,"Gut Kaden GC, Hamburg, Germany",Deutsche Bank - SAP Open TPC of Europe,2003,May 15 2003,Euro,2003
May 25 2003,https://www.europeantour.com//europeantour/season=2003/tournamentid=2003024/leaderboard/index.html,"Wentworth Golf Club, Virginia Water, Surrey, England",Volvo PGA Championship,2003,May 22 2003,Euro,2003
Jun 01 2003,https://www.europeantour.com//europeantour/season=2003/tournamentid=2003026/leaderboard/index.html,"The Celtic Manor Resort, City of Newport, Wales",Celtic Manor Resort Wales Open,2003,May 29 2003,Euro,2003
Jun 08 2003,https://www.europeantour.com//europeantour/season=2003/tournamentid=2003028/leaderboard/index.html,"Forest of Arden Hotel & CC, Coventry, England",Daily Telegraph Damovo British Masters,2003,Jun 05 2003,Euro,2003
Jun 15 2003,https://www.europeantour.com//europeantour/season=2003/tournamentid=2003029/leaderboard/index.html,"Aa Saint-Omer GC, Lumbres, France",Aa St Omer Open,2003,Jun 12 2003,Euro,2003
Jun 15 2003,https://www.europeantour.com//europeantour/season=2003/tournamentid=2003030/leaderboard/index.html,"Olympia Fields CC, Matteson, Illinois, USA",U.S. Open,2003,Jun 12 2003,Euro,2003
May 07 2000,https://www.europeantour.com//europeantour/season=2000/tournamentid=2000031/leaderboard/index.html,"Le Golf National, Paris, France",Novotel Perrier Open de France,2000,May 04 2000,Euro,2000
May 14 2000,https://www.europeantour.com//europeantour/season=2000/tournamentid=2000033/leaderboard/index.html,"The Belfry, Sutton Coldfield, England",Benson and Hedges International Open,2000,May 11 2000,Euro,2000
May 21 2000,https://www.europeantour.com//europeantour/season=2000/tournamentid=2000035/leaderboard/index.html,"Gut Kaden GC, Hamburg, Germany",Deutsche Bank-SAP Open TPC of Europe,2000,May 18 2000,Euro,2000
May 29 2000,https://www.europeantour.com//europeantour/season=2000/tournamentid=2000037/leaderboard/index.html,"Wentworth Golf Club, Virginia Water, Surrey, England",Volvo PGA Championship,2000,May 26 2000,Euro,2000
Jun 04 2000,https://www.europeantour.com//europeantour/season=2000/tournamentid=2000039/leaderboard/index.html,"Forest of Arden Hotel & CC, Coventry, England",Compass Group English Open,2000,Jun 01 2000,Euro,2000
Jun 11 2000,https://www.europeantour.com//europeantour/season=2000/tournamentid=2000041/leaderboard/index.html,"The Celtic Manor Resort, City of Newport, Wales",Celtic Manor Resort Wales Open,2000,Jun 08 2000,Euro,2000
Jun 22 2003,https://www.europeantour.com//europeantour/season=2003/tournamentid=2003032/leaderboard/index.html,"The Gleneagles Hotel, Perthshire, Scotland",Diageo Championship at Gleneagles,2003,Jun 19 2003,Euro,2003
Jun 29 2003,https://www.europeantour.com//europeantour/season=2003/tournamentid=2003034/leaderboard/index.html,"Le Golf National, Paris, France",Open de France,2003,Jun 26 2003,Euro,2003
Jul 06 2003,https://www.europeantour.com//europeantour/season=2003/tournamentid=2003036/leaderboard/index.html,"The K Club, Straffan, Co. Kildare, Republic of Ireland",Smurfit European Open,2003,Jul 03 2003,Euro,2003
Jul 13 2003,https://www.europeantour.com//europeantour/season=2003/tournamentid=2003038/leaderboard/index.html,"Loch Lomond GC, Glasgow, Scotland",Barclays Scottish Open,2003,Jul 10 2003,Euro,2003
Jul 20 2003,https://www.europeantour.com//europeantour/season=2003/tournamentid=2003040/leaderboard/index.html,"Royal St George’s GC, Sandwich, Kent, England",132nd Open Championship,2003,Jul 17 2003,Euro,2003
Jul 27 2003,https://www.europeantour.com//europeantour/season=2003/tournamentid=2003042/leaderboard/index.html,"Portmarnock, Dublin, Republic of Ireland",Nissan Irish Open,2003,Jul 24 2003,Euro,2003
Jun 18 2000,https://www.europeantour.com//europeantour/season=2000/tournamentid=2000043/leaderboard/index.html,"Pebble Beach Golf Links, Pebble Beach, California, USA",U.S. Open,2000,Jun 15 2000,Euro,2000
Jun 25 2000,https://www.europeantour.com//europeantour/season=2000/tournamentid=2000045/leaderboard/index.html,"De Vere Slaley Hall, Hexham, England",Compaq European Grand Prix,2000,Jun 22 2000,Euro,2000
Jul 02 2000,https://www.europeantour.com//europeantour/season=2000/tournamentid=2000048/leaderboard/index.html,"Ballybunion GC, Co. Kerry, Republic of Ireland",Murphy's Irish Open,2000,Jun 29 2000,Euro,2000
Jul 09 2000,https://www.europeantour.com//europeantour/season=2000/tournamentid=2000051/leaderboard/index.html,"The K Club, Straffan, Co. Kildare, Republic of Ireland",Smurfit European Open,2000,Jul 06 2000,Euro,2000
Jul 15 2000,https://www.europeantour.com//europeantour/season=2000/tournamentid=2000054/leaderboard/index.html,"Loch Lomond GC, Glasgow, Scotland",Standard Life Loch Lomond,2000,Jul 12 2000,Euro,2000
Jul 23 2000,https://www.europeantour.com//europeantour/season=2000/tournamentid=2000056/leaderboard/index.html,"St. Andrews, Old Course, Fife, Scotland",129th Open Championship,2000,Jul 20 2000,Euro,2000
Jul 30 2000,https://www.europeantour.com//europeantour/season=2000/tournamentid=2000058/leaderboard/index.html,"Noordwijkse GC, Noordwijk, Netherlands",TNT Dutch Open,2000,Jul 27 2000,Euro,2000
Aug 06 2000,https://www.europeantour.com//europeantour/season=2000/tournamentid=2000061/leaderboard/index.html,"Kungsangen GC, Stockholm, Sweden",Volvo Scandinavian Masters,2000,Aug 03 2000,Euro,2000
Aug 03 2003,https://www.europeantour.com//europeantour/season=2003/tournamentid=2003044/leaderboard/index.html,"Barsebäck G&CC, Malmö, Sweden",Scandic Carlsberg Scandinavian Masters,2003,Jul 31 2003,Euro,2003
Aug 10 2003,https://www.europeantour.com//europeantour/season=2003/tournamentid=2003046/leaderboard/index.html,"Simons GC, Copenhagen, Denmark",Nordic Open,2003,Aug 07 2003,Euro,2003
Aug 17 2003,https://www.europeantour.com//europeantour/season=2003/tournamentid=2003047/leaderboard/index.html,"Le Meridien Moscow CC, Moscow, Russia",BMW Russian Open,2003,Aug 14 2003,Euro,2003
Aug 17 2003,https://www.europeantour.com//europeantour/season=2003/tournamentid=2003048/leaderboard/index.html,"Oak Hill CC, Rochester, New York, USA",US PGA Championship,2003,Aug 14 2003,Euro,2003
Aug 24 2003,https://www.europeantour.com//europeantour/season=2003/tournamentid=2003050/leaderboard/index.html,"Firestone CC, Akron, Ohio, USA",WGC-NEC Invitational,2003,Aug 21 2003,Euro,2003
Aug 31 2003,https://www.europeantour.com//europeantour/season=2003/tournamentid=2003052/leaderboard/index.html,"Golfclub München Eichenried, Eichenried, Munich, Germany",BMW International Open,2003,Aug 28 2003,Euro,2003
Sep 07 2003,https://www.europeantour.com//europeantour/season=2003/tournamentid=2003054/leaderboard/index.html,"Crans-sur-Sierre GC, Crans Montana, Switzerland",Omega European Masters,2003,Sep 04 2003,Euro,2003
Sep 14 2003,https://www.europeantour.com//europeantour/season=2003/tournamentid=2003056/leaderboard/index.html,"Saint-Nom-La-Bretèche, Paris, France",Trophée Lancôme,2003,Sep 11 2003,Euro,2003
Sep 21 2003,https://www.europeantour.com//europeantour/season=2003/tournamentid=2003058/leaderboard/index.html,"Golf Club Gut Lärchenhof, Cologne, Germany",Linde German Masters,2003,Sep 18 2003,Euro,2003
Aug 13 2000,https://www.europeantour.com//europeantour/season=2000/tournamentid=2000064/leaderboard/index.html,"Woburn GC, Buckinghamshire, England",Victor Chandler British Masters,2000,Aug 10 2000,Euro,2000
Aug 20 2000,https://www.europeantour.com//europeantour/season=2000/tournamentid=2000067/leaderboard/index.html,"Valhalla GC, Louisville, Kentucky, USA",US PGA Championship,2000,Aug 17 2000,Euro,2000
Aug 20 2000,https://www.europeantour.com//europeantour/season=2000/tournamentid=2000068/leaderboard/index.html,"Slieve Russell Hotel G&CC, Co. Cavan, Republic of Ireland",Buzzgolf.com North West of Ireland Open,2000,Aug 17 2000,Euro,2000
Aug 27 2000,https://www.europeantour.com//europeantour/season=2000/tournamentid=2000070/leaderboard/index.html,"Firestone CC, Akron, Ohio, USA",WGC-NEC Invitational,2000,Aug 24 2000,Euro,2000
Aug 27 2000,https://www.europeantour.com//europeantour/season=2000/tournamentid=2000071/leaderboard/index.html,"The Gleneagles Hotel, Perthshire, Scotland",Scottish PGA Championship,2000,Aug 24 2000,Euro,2000
Sep 03 2000,https://www.europeantour.com//europeantour/season=2000/tournamentid=2000073/leaderboard/index.html,"Golfclub München Eichenried, Eichenried, Munich, Germany",BMW International Open,2000,Aug 31 2000,Euro,2000
